sep=,

File creation date: 20/02/2016
Annex III,Last update: 05/08/2015
LIST OF SUBSTANCES WHICH COSMETIC PRODUCTS MUST NOT CONTAIN EXCEPT SUBJECT TO THE RESTRICTIONS LAID DOWN

Substance identification,Restrictions

Reference number,Chemical name / INN,Name of Common Ingredients Glossary,CAS Number,EC Number,"Product Type, body parts",Maximum concentration in ready for use preparation,Other,Wording of conditions of use and warnings,Regulation,Regulated By,Other Directives/Regulations,SCCS opinions,Chemical/IUPAC Name,Identified INGREDIENTS or substances e.g.,CMR,Update date
1a,"Boric acid, borates and tetraborates with the exception of substance no 1184 in Annex II","BORIC ACID","10043-35-3 / 11113-50-1","233-139-2 / 234-343-4","(a) Talc (b) Oral products (c) Other products (excluding bath products and hair waving products) ","(a) 5% (as boric acid)  (b) 0.1% (as boric acid)  (c) 3% (as boric acid)","(a)  Not to be used in products for children under 3 years of age  Not to be used on peeling or irritated skin if the concentration of free soluble borates exceeds 1.5% (as boric acid)  (b) Not to be used in products for children under 3 years of age  (c)  Not to be used in products for children under 3 years of age  Not to be used on peeling or irritated skin if the concentration of free soluble borates exceeds 1.5% (as boric acid)  ","(a) Not to be used for children under 3 years of age  Not to be used on peeling or irritated skin  (b) Not to be swallowed  Not to be used for children under 3 years of age  (c) Not to be used for children under 3 years of age  Not to be used on peeling or irritated skin","(EC) No 1223/2009","2005/80/EC","790/2009 ","1249/09-Opinion on Boron compounds;1345/10-Opinion on Sodium Perborate and Perboric Acid;1523/13-Opinion on the safety of boron compounds in cosmetic products.;0025/98-Opinion on Boric acid, Borates and Tetraborates","","BORIC ACID;MEA-BORATE;MIPA-BORATE;POTASSIUM BORATE;SODIUM BORATE;SODIUM PERBORATE;TRIOCTYLDODECYL BORATE;ZINC BORATE","Reprotoxic Cat. 1B (C>=5.5%)  ",13/06/2014
1b,"Tetraborates, see also 1a)","","","","(a) Bath products (b) Hair products ","(a) 18% (as boric acid) (b) 8% (as boric acid) ","(a) Not to be used in products for children under 3 years of age ","(a) Not to be used for children under 3 years of age (b) Rinse well ","(EC) No 1223/2009","2000/6/EC","","1523/13-Opinion on the safety of boron compounds in cosmetic products.;0025/98-Opinion on Boric acid, Borates and Tetraborates","","POTASSIUM BORATE;SODIUM BORATE","",13/06/2014
2a,"Thioglycolic acid and its salts","THIOGLYCOLIC ACID","68-11-1","200-677-4","(a) Hair products (b) Depilatories (c) Hair rinse -off products  (d) Products intended for eyelash waving","(a)  1) 8%  2) 11%  (b)  5%  (c) 2%  (d) 11% The abovementioned percentages are calculated as thioglycollic acid","(a) General use ready for use pH 7 to 9.5  Professional use ready for use pH 7 to 9.5  (b) ready for use pH 7 to 12.7  (c) ready for use pH 7 to 9.5 (d) ready for use pH 7 to 9,5   ","Condition of use: (a) (b) (c) Avoid contact with eyes  In the event of contact with eyes, rinse immediately with plenty of water and seek medical advice  (a) (c) (d) Wear suitable gloves  Warnings to be printed on the label: (a) (b) (c) Contains thioglycolate  Follow the instructions  Keep out of reach of children (a) (d) For professional use only: Cotains thiglycolata, folow the instruction. ","(EC) No 1223/2009","88/233/EEC","","1520/13-Thioglycolic acid and its salts (TGA)","","AMMONIUM THIOGLYCOLATE;CALCIUM THIOGLYCOLATE;CALCIUM THIOGLYCOLATE HYDROXIDE;ETHANOLAMINE THIOGLYCOLATE;MAGNESIUM THIOGLYCOLATE;POTASSIUM THIOGLYCOLATE;SODIUM THIOGLYCOLATE;STRONTIUM THIOGLYCOLATE;THIOGLYCOLIC ACID","",05/08/2015
2b,"Thioglycolic acid esters","","","","Hair waving or straightening products ","(a) 8%  (b) 11%  The abovementioned percentages are calculated as thioglycollic acid","(a) General use ready for use pH 6 to 9.5  (b) Professional use ready for use pH 6 to 9.5  ","Conditions of use: (a) (b) May cause sensitization in the event of skin contact  Avoid contact with eyes  In the event of contact with eyes, rinse immediately with plenty of water and seek medical advice  Wear suitable gloves Warnings: Contains thioglycolate  Follow the instructions Keep out of reach of children (b) For professional use only ","(EC) No 1223/2009","88/233/EEC","","","","BUTYL THIOGLYCOLATE;ETHYL THIOGLYCOLATE;GLYCERYL THIOGLYCOLATE;ISOOCTYL THIOGLYCOLATE;ISOPROPYL THIOGLYCOLATE;METHYL THIOGLYCOLATE","",17/10/2010
3,"Oxalic acid, its esters and alkaline salts","OXALIC ACID","144-62-7","205-634-3","Hair products","5%","Professional use ","For professional use only","(EC) No 1223/2009","82/368/EEC","","","","DIBUTYL OXALATE;DIETHYL OXALATE;DIISOBUTYL OXALATE;DIISOPROPYL OXALATE;DILITHIUM OXALATE;DIMETHYL OXALATE;DIPOTASSIUM OXALATE;DIPROPYL OXALATE;OXALIC ACID;SODIUM OXALATE","",17/10/2010
4,"Ammonia","AMMONIA","7664-41-7 / 1336-21-6","231-635-3 / 215-647-6","","6% (as NH3)","","Above 2%: Contains ammonia","(EC) No 1223/2009","82/368/EEC","","","","AMMONIA;AMMONIUM HYDROXIDE","",17/10/2010
5,"Tosylchloramide sodium (INN)","CHLORAMINE-T","127-65-1","204-854-7","","0.2%","","","(EC) No 1223/2009","82/368/EEC","","","Benzenesulfonamide, N-chloro-4-methyl-, sodium salt (1:1) 
 
","CHLORAMINE T","",17/10/2010
6,"Chlorates of alkali metals","POTASSIUM CHLORATE / SODIUM CHLORATE ","3811-04-9 / 7775-09-9","223-289-7 / 231-887-4","(a) Toothpaste (b) Other products","(a) 5% (b) 3% ","","","(EC) No 1223/2009","82/368/EEC","","","","POTASSIUM CHLORATE;SODIUM CHLORATE","",04/11/2010
7,"Dichloromethane","DICHLOROMETHANE","75-09-2","200-838-9","","35% (when mixed with 1,1,1 -trichloroethane, total concentration must not exceed 35%)","0.2% as maximum impurity content","","(EC) No 1223/2009","82/368/EEC","","","","DICHLOROMETHANE","Carcinogenic Cat. 2  ",17/10/2010
8a,"p -Phenylenediamine and its salts","","106-50-3 / 624-18-0 / 16245-77-5","203-404-7 / 210-834-9 / 240-357-1","Hair dye substance in oxidative hair dye products","","(a) General use (b) Professional use For (a) and (b): After mixing under oxidative conditions the maximum concentration applied to hair must not exceed 2 % calculated as free base","(a) To be printed on the label: The mixing ratio. ‘ Hair colourants can cause severe allergic reactions. Read and follow instructions. This product is not intended for use on persons under the age of 16. Temporary “black henna” tattoos may increase your risk of allergy. Do not colour your hair if: — you have a rash on your face or sensitive, irritated and damaged scalp, — you have ever experienced any reaction after colouring your hair, — you have experienced a reaction to a temporary “black henna” tattoo in the past. Contains phenylenediamines. Do not use to dye eyelashes or eyebrows.’ (b) To be printed on the label: The mixing ratio. ‘For professional use only. Hair colourants can cause severe allergic reactions. Read and follow instructions. This product is not intended for use on persons under the age of 16. Temporary “black henna” tattoos may increase your risk of allergy. Do not colour your hair if: — you have a rash on your face or sensitive, irritated and damaged scalp, — you have ever experienced any reaction after colouring your hair, — you have experienced a reaction to a temporary “black henna” tattoo in the past. Contains phenylenediamines. Wear suitable gloves.’","(EC) No 344/2013","","","","p-Phenylenediamine; p-Phenylenediamine HCl; p-Phenylenediamine Sulphate","","",03/03/2015
8b,"p - Phenylene-diamine and its salts","P-PHENYLENEDIAMINE; P-PHENYLENEDIAMINE HCL; P-PHENYLENEDIAMINE SULPHATE","106-50-3 / 624-18-0 / 16245-77-5","203-404-7 / 210-834-9 / 240-357-1","Products intended for colouring eyelashes","","After mixing under oxidative conditions the maximum concentration applied to eyelashes must not exceed 2 % calculated as free base. For professional use only.","To be printed on the label: The mixing ratio. “For professional use only. This product can cause severe allergic reactions. Read and follow instructions. This product is not intended for use on persons under the age of 16. Temporary ‘black henna’ tattoos may increase the risk of allergy. Eyelashes shall not be coloured if the consumer: — has a rash on the face or sensitive, irritated and damaged scalp, — has experienced any reaction after colouring hair or eyelashes, — has experienced a reaction to a temporary ‘black henna’ tattoo in the past. Rinse eyes immediately if product comes into contact with them. Contains phenylenediamines. Wear suitable gloves.” ’","(EC) No 1197/2013","","","0989/06-Opinion on p-Phenylenediamine;1054/06-Memorandum on Hair Dye Substances and their Skin Sensitising Properties;1311/10-Opinion on reaction products of oxidative hair dye ingredients formed during hair dyeing processes;0129/99-Opinion concerning p-Phenylenediamine","p- Phenylene-diamine and its salts","","",12/02/2014
8,"N -substituted derivatives of p- Phenylenediamine and their salts; N- substituted derivatives of o-Phenylenediamine (1 ), with exception of those derivatives listed elsewhere in this Annex and under reference numbers 1309, 1311, and 1312 in Annex II","","","","Hair dye substance in oxidative hair dye products","(a) General use (b) Professional use  For (a) and (b): After mixing under oxidative conditions the maximum concentration applied to hair must not exceed 3 % calculated as free base","(1 ) These substances may be used singly or in combination provided that the sum of the ratios of the levels of each of them in the cosmetic product expressed with reference to the maximum level authorised for each of them does not exceed 1.’","(a) To be printed on the label: The mixing ratio. “ Hair colourants can cause severe allergic reactions. Read and follow instructions. This product is not intended for use on persons under the age of 16. Temporary ‘black henna’ tattoos may increase your risk of allergy. Do not colour your hair if: — you have a rash on your face or sensitive, irritated and damaged scalp, — you have ever experienced any reaction after colouring your hair, — you have experienced a reaction to a temporary ‘black henna’ tattoo in the past. Contains phenylenediamines. Do not use to dye eyelashes or eyebrows” (b) To be printed on the label: The mixing ratio. “For professional use only Hair colourants can cause severe allergic reactions. Read and follow instructions. This product is not intended for use on persons under the age of 16. Temporary ‘black henna’ tattoos may increase your risk of allergy. Do not colour your hair if: — you have a rash on your face or sensitive, irritated and damaged scalp, — you have ever experienced any reaction after colouring your hair, — you have experienced a reaction to a temporary ‘black henna’ tattoo in the past. Contains phenylenediamines. Wear suitable gloves”","(EC) No 344/2013","","","0484/01-Opinion on the Use of Permanent Hair Dyes and Bladder Cancer Risk;0553/02-Assessment Strategies for Hair Dyes;0720/03-Updated Recommended Strategy for Testing Hair Dyes for Their Potential Genotoxicity/Mutagenicity/Carcinogenicity;0797/04-Opinion concerning Use of Permanent Hair Dyes and Bladder Cancer - Updated 2004;0930/05-Opinion on Personal Use of Hair Dyes and Cancer Risk;0989/06-Opinion on p-Phenylenediamine;1054/06-Memorandum on Hair Dye Substances and their Skin Sensitising Properties;0059/98-Foreseeable use of hair dyes;0129/99-Opinion concerning p-Phenylenediamine","","","",17/06/2014
9a,"Toluene -2,5-diamine  Toluene-2,5-diamine sulphate ","","95-70-5 / 615-50-9","202-442-1 / 210-431-8","Hair dye substance in oxidative hair dye products (a) General use (b) Professional use For (a) and (b): After mixing under oxidative conditions the maximum concentration to hair must not exceed 4% calculated as free base.","","(a) and (b) After mixing under oxidative conditions the maximum concentration applied to hair must not exceed 4% calculated as free base","(a)  Hair colorants can cause severe allergic reactions.  Read and follow instructions.  This product is not intended for use on persons under the age of 16.  Temporary black henna tattoos may increase your risk of allergy.  Do not colour your hair if:   - you have a rash on your face or sensitive, irritated and damaged scalp,  - you have ever experienced any reaction after colouring your hair,  - you have experienced a reaction to a temporay black henna tattoo in the past.  Contains phenylenediamines (toluenediamines). Do not use to dye eyelashes or eyebrows. The mixing ratio is printed on the label  (b) For professional use only   Hair colorants can cause severe allergic reactions.  Read and follow instructions.  This product is not intended for use on persons under the age of 16.  Temporary black henna tattoos may increase your risk of allergy.  Do not colour your hair if:  - you have a rash on your face or sensitive, irritated and damaged scalp,  - you have ever experienced any reaction after colouring your hair,  - you have experienced a reaction to a temporay black henna tattoo in the past.  Contains phenylenediamines (toluenediamines). Wear suitable gloves. The mixing ratio is printed on the label  ","(EC) No 344/2013","","","1054/06-Memorandum on Hair Dye Substances and their Skin Sensitising Properties;1084/07-Opinion on Toluene-2,5-diamine","","","",16/06/2014
9,"Methylphenylenediamines, their N -substituted derivatives and their salts (1) with the exception of the substance under reference number 9a in this annex and substances under reference numbers 364, 1310 and 1313 in Annex II","","","","Hair dye substance in oxidative hair dye products","(a) General use (b) Professional use For (a) and (b): After mixing under oxidative conditions the maximum concentration applied to hair must not exceed 5 % calculated as free base","","(a) To be printed on the label: The mixing ratio. “ Hair colourants can cause severe allergic reactions. Read and follow instructions. This product is not intended for use on persons under the age of 16. Temporary ‘black henna’ tattoos may increase your risk of allergy. Do not colour your hair if: — you have a rash on your face or sensitive, irritated and damaged scalp, — you have ever experienced any reaction after colouring your hair, — you have experienced a reaction to a temporary ‘black henna’ tattoo in the past. Contains phenylenediamines (toluenediamines). Do not use to dye eyelashes or eyebrows.”  (b) To be printed on the label: The mixing ratio. “For professional use only Hair colourants can cause severe allergic reactions. Read and follow instructions. This product is not intended for use on persons under the age of 16. Temporary ‘black henna’ tattoos may increase your risk of allergy. Do not colour your hair if: — you have a rash on your face or sensitive, irritated and damaged scalp, — you have ever experienced any reaction after colouring your hair, — you have experienced a reaction to a temporary ‘black henna’ tattoo in the past. Contains phenylenediamines (toluenediamines). Wear suitable gloves.”","(EC) No 344/2013","","","0484/01-Opinion on the Use of Permanent Hair Dyes and Bladder Cancer Risk;0553/02-Assessment Strategies for Hair Dyes;0697/03-Opinion concerning 2,6-Dihydroxyethylaminotoluene;0720/03-Updated Recommended Strategy for Testing Hair Dyes for Their Potential Genotoxicity/Mutagenicity/Carcinogenicity;0797/04-Opinion concerning Use of Permanent Hair Dyes and Bladder Cancer - Updated 2004;0930/05-Opinion on Personal Use of Hair Dyes and Cancer Risk;0971/06-Updated Recommended Strategy for Testing Oxidative Hair Dye Substances for their Potential Mutagenicity/Genotoxicity;1054/06-Memorandum on Hair Dye Substances and their Skin Sensitising Properties;1084/07-Opinion on Toluene-2,5-diamine","","","",17/06/2014
10,"Diaminophenols (1)","","","","Oxidising colouring agents for hair dyeing","10% (as free base)","(a) General use Not to be used on eyebrows (b) Professional use","(a) Can cause an allergic reaction Do not use to dye eyleashes or eyebrows (b) For professional use only Can cause an allergic reaction Wear suitable gloves ","(EC) No 1223/2009","","","","","","",17/10/2010
11,"Dichlorophen","DICHLOROPHEN","97-23-4","202-567-1","","0.5%","","Contains Dichlorophen","(EC) No 1223/2009","87/137/EEC","","","","DICHLOROPHENE","",04/11/2010
12,"Hydrogen peroxide, and other compounds or mixtures that release hydrogen peroxide, including carbamide peroxide and zinc peroxide","HYDROGEN PEROXIDE","7722-84-1","231-765-0","(a) Hair products (b) Skin products (c) Nail hardening products (d) Oral products, including mouth rinse, tooth paste and tooth whitening or bleaching products (e) Tooth whitening or bleaching products (f) Products intended for eyelashes","(a) 12% of H2O2 (40 volumes), present or released (b) 4% of H2O2, present or released (c) 2% of H2O2, present or released (d) ≤ 0,1 % of H 2O 2, present or released e) > 0,1 % ≤ 6 % of H2O2, present or released (f) 2 % of H 2O 2, present or released","(e) To be only sold to dental practitioners. For each cycle of use, first use by dental practitioners as defined under Directive 2005/36/EC (*) or under their direct supervision if an equivalent level of safety is ensured. Afterwards to be provided to the consumer to complete the cycle of use. Not to be used on a person under 18 years of age. (f) For professional use only","For (a) and (f): Wear suitable gloves For (a) (b) (c) and (e): Contains hydrogen peroxide. Avoid contact with eyes. Rinse immediately if product comes into contact with them. (e) Concentration of H 2O 2 present or released indicated in percentage. Not to be used on a person under 18 years of age. To be only sold to dental practitioners. For each cycle of use, the first use to be only done by dental practitioners or under their direct supervision if an equivalent level of safety is ensured. Afterwards to be provided to the consumer to complete the cycle of use. (f) To be printed on the label: “For professional use only. Avoid contact with eyes. Rinse eyes immediately if product comes into contact with them. Contains hydrogen peroxide.”","(EC) No 1197/2013","93/47/EEC","","0602/02-Opinion concerning Hydrogen (Carbamide, Zinc) Peroxide in Tooth Bleaching/Whitening Products;0844/04-Opinion on Hydrogen Peroxide in Tooth Whitening products;0974/06-Guidance document on Epidemiological and clinical studies on Tooth Whitening Products;1129/07-Opinion on Hydrogen peroxide, in its free form or when released, oral hygiene products;0058/98-Opinion of concerning Hydrogen (Carbamide) Peroxide in Tooth Whitening Products;0158/99-Opinion concerning Hydrogen Peroxide and Hydrogen Peroxide releasing Substances used in Oral Care Products;0200/99-Clarification on Hydrogen (Carbamide) peroxide in Tooth Whitening Products","","CALCIUM PEROXIDE;HYDROGEN PEROXIDE;MAGNESIUM PEROXIDE;PVP-HYDROGEN PEROXIDE;SODIUM CARBONATE PEROXIDE;SODIUM PERBORATE;STRONTIUM PEROXIDE;UREA PEROXIDE;ZINC PEROXIDE","",14/02/2014
13,"Formaldehyde (2)","FORMALDEHYDE","50-00-0","200-001-8","Nail hardening products","5 % (as formaldehyde)","For purposes other than inhibiting the development of microorganisms in the product. This purpose has to be apparent from the presentation of the product","Protect cuticles with grease or oil Contains formaldehyde (3)","(EC) No 1223/2009","82/368/EEC","","1538/14-Opinion on the safety of the use of formaldehyde in nailhardeners ","","FORMALDEHYDE","Carcinogenic Cat. 2 (when C=>1%)  ",10/06/2015
14,"Hydroquinone","HYDROQUINONE","123-31-9","204-617-8","Artificial nail systems ","0.02% (after mixing for use) ","Professional use "," - For professional use only  - Avoid skin contact  - Read directions for use carefully ","(EC) No 344/2013","2008/88/EC","","0486/01-Opinion on The Use of Benzoyl Peroxide (BPO), Hydroquinone (HQ), Hydroquinone methylether (MEHQ) in artificial nail systems;0059/98-Foreseeable use of hair dyes;0078/98-Opinion concerning Hydroquinone (1,4-Dihydroxybenzene) as a Hair Dye Constituent","","HYDROQUINONE","Carcinogenic Cat. 2  Mutagenic Cat. 2  ",14/05/2013
15a,"Potassium or sodium hydroxide","POTASSIUM HYDROXIDE / SODIUM HYDROXIDE","1310-58-3 / 1310-73-2","215-181-3 / 215-185-5","(a) Nail cuticle solvent (b) Hair straightener (c) pH adjuster for depilatories (d) Other uses as pH adjuster ","(a) 5% (5) (b)  1. 2% (5) 2. 4.5% (5) ","(b) 1. General use 2. Professional use (c) up to pH 12.7 (d) up to pH 11 ","(a) Contains alkali  Avoid contact with eyes  Can cause blindness  Keep out of reach of children (b) 1. Contains alkali Avoid contact with eyes  Can cause blindness  Keep out of reach of children 2. For professional use only  Avoid contact with eyes  Can cause blindness (c) Keep out of reach of children  Avoid contact with eyes ","(EC) No 1223/2009","96/41/EC","","1527/14-Opinion on Potassium hydroxide (KOH) as callosity softener/remover","","POTASSIUM HYDROXIDE;SODIUM HYDROXIDE","",12/06/2014
15b,"Lithium hydroxide","LITHIUM HYDROXIDE","1310-65-2","215-183-4","(a) Hair straightener (b) pH ajuster for depilatories (c) Other uses as pH ajuster (for rinse -off products only)  ","(a)  1. 2% (6) 2. 4.5% (6) ","(a) 1. General use 2. Professional use (b) pH < 12.7 (c) pH < 11","(a)  1. Contains alkali  Avoid contact with eyes  Can cause blindness  Keep out of reach of children 2. Avoid contact with eyes  Can cause blindness (b) Contains alkali  Keep out of reach of children  Avoid contact with eyes ","(EC) No 1223/2009","2002/34/EC","","0295/00-Opinion on Lithium Hydroxyde and Calcium Hydroxide","","LITHIUM HYDROXIDE","",17/10/2010
15c,"Calcium hydroxide","CALCIUM HYDROXIDE","1305-62-0","215-137-3","(a) Hair straighteners containing two components: calcium hydroxide and a guanidine salt (b) pH ajuster for depilatories (c) Other uses (e.g. pH adjuster, processing aid) ","(a) 7% (as calcium hydroxide) ","(b) pH < 12.7 (c) pH < 11 ","(a) Contains alkali Avoid contact with eyes  Keep out of reach of children  Can cause blindness (b) Contains alkali  Keep out of reach of children  Avoid contact with eyes ","(EC) No 1223/2009","2002/34/EC","","0295/00-Opinion on Lithium Hydroxyde and Calcium Hydroxide","","CALCIUM HYDROXIDE","",17/10/2010
16,"1 - Naphthalenol","1-NAPHTHOL","90-15-3","201-969-4","Hair dye substance in oxidative hair dye products","","After mixing under oxidative conditions the maximum concentration applied to hair must not exceed 2,0%","To be printed on the label: Hair colorants can cause severe allergic reactions.","658/2013/EU","","","","1- Naphthalenol","","",09/09/2013
16,"1 -Naphthol and its salts","1-NAPHTHOL","90-15-3","201-969-4","Hair dye substance in oxidative hair dye products","","After mixing under oxidative conditions the maximum concentration applied to hair must not exceed 1 % calculated as free base","Hair colourants can cause severe allergic reactions. Read and follow instructions. This product is not intended for use on persons under the age of 16. Temporary ‘black henna’ tattoos may increase your risk of allergy. Do not colour your hair if: — you have a rash on your face or sensitive, irritated and damaged scalp, — you have ever experienced any reaction after colouring your hair, — you have experienced a reaction to a temporary ‘black henna’ tattoo in the past","(EC) No 344/2013","2009/134/EC","","0484/01-Opinion on the Use of Permanent Hair Dyes and Bladder Cancer Risk;0553/02-Assessment Strategies for Hair Dyes;0720/03-Updated Recommended Strategy for Testing Hair Dyes for Their Potential Genotoxicity/Mutagenicity/Carcinogenicity;0797/04-Opinion concerning Use of Permanent Hair Dyes and Bladder Cancer - Updated 2004;0930/05-Opinion on Personal Use of Hair Dyes and Cancer Risk;0971/06-Updated Recommended Strategy for Testing Oxidative Hair Dye Substances for their Potential Mutagenicity/Genotoxicity;1054/06-Memorandum on Hair Dye Substances and their Skin Sensitising Properties;1123/07-Opinion on 1-Naphthol;0130/99-Opinion concerning 1-Naphthol","","1-NAPHTHOL;(*)Potassium naphtholate; 1-Naphthalenol, potassium salt (1:1) ","",14/05/2013
17,"Sodium nitrite","SODIUM NITRITE","7632-00-0","231-555-9","Rust inhibitor","0.2%","Not to be used with secondary and/or tertiary amines or other substances forming nitrosamines","","(EC) No 1223/2009","82/368/EEC","","","","SODIUM NITRITE","",17/10/2010
18,"Nitromethane","NITROMETHANE","75-52-5","200-876-6","Rust inhibitor","0.3%","","","(EC) No 1223/2009","82/368/EEC","","","","NITROMETHANE","",17/10/2010
19,"Moved or deleted","","","","","","","","(EC) No 1223/2009","","","","","","",17/10/2010
20,"Moved or deleted","","","","","","","","(EC) No 1223/2009","","","","","","",17/10/2010
21,"Cinchonan -9-ol, 6'-methoxy-, (8.alpha.,9R)- its salts","QUININE","130-95-0","205-003-2","(a) Hair rinse -off products (b) Hair leave-on products ","(a) 0.5% (as quinine base) (b) 0.2% (as quinine base) ","","","(EC) No 1223/2009","82/368/EEC","","","(8S,9R)-6'-Methoxycinchonan-9-ol 
","QUININE","",17/10/2010
